givenname,surname,given_first,title,description,industry,tags,cis_white_man,robbins_lecture_yr,note
Thomas,Cech,TRUE,Dr.,"Thomas Cech, born in 1947, is best known for his research on RNA and telomeres. He and his wife, both chemists, obtained their PhDs from the University of California, Berkeley in 1975, before both becoming faculty at the University of Colorado, Boulder in 1978 (where they have stayed ever since). Cech discovered that RNA could splice itself and catalyze other biochemical reactions; these are now known as ribozymes. Cech won the Nobel Prize in Chemistry in 1989 for this discovery. Professor Cech also has researched telomeres, the ends of DNA molecules which are shortened with replication and often malfunction in cancerous cells. Professor Cech delivered the 33rd Robbins Lecture at Pomona College in 1994.",,"robbins, nobel",TRUE,1994,
Richard N.,Zare,TRUE,Dr.,"Born in 1939, Richard Zare is most known for his work on Laser Induced Fluorescence. One of the most famous applications for LIF was the sequencing of the human genome. He earned his Bachelor’s in 1961 in chemistry and physics from Harvard University.  Three years later, he earned his PhD in physical and analytical chemistry. Zare was a strong advocate for women in science. He mentored 49 minority PhD students. In 1977, Zare became a full time chemistry professor position at Stanford University. Richard N. Zare was the Robbins Lecturer at Pomona College in 1995. ",,,TRUE,1995,
Sherwood,Roland,TRUE,Dr.,"Born in 1927, Sherwood Rowland is best known for his discovery of the connection between chlorofluorocarbon (CFC) usage and ozone depletion in the atmosphere. He graduated high school at age 16, and after a year of military service during World War II, received his undergraduate degree at age 21. He enrolled at the University of Chicago, where he earned his PhD in chemistry in 1952 while competing on varsity athletic teams. After years on the Princeton and Kansas faculty, Professor Rowland joined the new University of California, Irvine in 1964. It was here where Rowland performed most of his notable work. Rowland theorized that CFCs would break down in the upper atmosphere, releasing ozone-depleting radicals. His theories were soon proven correct through lab experiments and evidence from the Antarctic. His subsequent advocacy for the phase-out of CFCs led to global action (like the Montreal Protocol) in the 1980s. For his work on ozone depletion, Rowland received the 1995 Nobel Prize in Chemistry. Professor Rowland, whose daughter attended Pomona College, delivered the 35th Robbins Lecture in 1996. ",,"robbins, nobel",TRUE,1996,
Stuart L.,Schreiber,TRUE,Dr.,"Born in 1956, Stuart Schreiber is best known for his work in chemical biology. In 1977, he earned his Bachelor’s in chemistry from the University of Virginia and continued his graduate studies in chemistry at the Harvard University. Schreiber was a co-founder of the Board Institute, which is a biomedical research center that is partnered with MIT and Harvard University. His research attempts to integrate chemical biology and human biology. He played an important role in developing the field of human biology. In 1991, Schreiber’s lab mapped the first membrane-to-nucleus signaling pathway. Stuart Schreiber was the Robbins Lecturer in 1997 at Pomona College.",,robbins,TRUE,1997,
Richard,Ernst,TRUE,Dr.,"Richard Ernst, born in 1933, was most famous for his nuclear magnetic resonance (NMR) spectroscopy innovations. He had an early aptitude for chemistry, but when he attended the Swiss Federal Institute of Technology, Zurich, he was underwhelmed by the curriculum. He received his PhD there in 1962, then moved to the Bay Area to join technology company Varian Associates. At Varian, Ernst dramatically improved spectroscopy by inventing the Fourier transform NMR spectroscopy (along with several other NMR techniques). In 1975, Ernst returned to his alma mater to become a Professor of Physical Chemistry while heading a research lab studying improvements NMR. Outside of research, Ernst enjoyed music and art, particularly Tibetan scrolls. Professor Ernst delivered the 37th Robbins Lecture at Pomona College in 1998.",,robbins,TRUE,1998,
George A.,Olah,TRUE,Dr.,"Born in 1927 to a Jewish parents, George Olah is known for his work on carbocations. Olah attended one of the best secondary schools in Hungary. He earned his Master’s and PhD in chemical engineering from the Technical University of Budapest. In 1977, Olah moved to USC and became the director of the Loker Hydrocarbon Research Institute. He was able to successfully stabilize carbocations using superacids. This discovery led scientists to use infrared spectroscopy to study them and the development of higher octane gasoline. George Olah was awarded The Nobel Prize in Chemistry in 1994. Five years later, He was the Robbins Lecturer at Pomona College.",,"robbins, nobel",TRUE,1999,
Paul,Anderson,TRUE,Dr.,"Born in 1938, Paul Anderson is renowned for his work in the pharmaceutical industry. He studied chemistry at the University of Vermont, graduating in 1959, before earning his PhD from the University of New Hampshire in 1963. A medicinal chemist actively involved in research, Dr. Anderson joined the pharmaceutical company Merck, where he worked for over three decades. He became Merck’s Vice President of Chemical and Physical Sciences in 1994, leading drug discovery efforts. In 1997, Dr. Anderson was named the director of the American Chemical Society (ACS). Dr. Anderson earned the Priestley Medal, the highest award the ACS bestows, in 2006. Dr. Anderson gave the 39th Robbins Lecture at Pomona College in 2000.",Medicinal Chemistry,robbins,TRUE,2000,
Ahmed,Zewali,TRUE,Dr.,"Ahmed Zewail, born in 1946, is most famous for being the “father of femtochemistry”. His early years were spent in Disuq, a Egyptian city not far from Alexandria. He developed an early aptitude for mathematics and chemistry, and was admitted to Alexandria University to study science. Here, Zewail was an excellent student and discovered his love for chemistry. He graduated in 1967, but stayed to complete research for his Masters degree. Wishing to fulfill another of his parents’ dreams, Zewail applied to various PhD programs in the United States. Diplomatic tensions between Egypt and the US made this difficult, but the University of Pennsylvania offered Zewail a scholarship, which he accepted. Despite culture shock and being seen as a foreigner, Zewail excelled at Penn and earned his PhD in 1973. Dr. Zewail wanted to return to Egypt, but war and unrest there kept him in the United States. After a few years in Berkeley, Dr. Zewail accepted a position at Caltech. Much of his most groundbreaking work was performed there: Zewail used ultrafast laser techniques to study chemical reactions occurring in femtoseconds. His work made it possible to analyze transition states and map reaction mechanisms at great resolution. Professor Zewail earned the 1999 Nobel Prize in Chemistry for this work. In 2011, Zewail returned to Egypt to join a committee for constitutional reform during the Arab Spring protests. Professor Zewail delivered the 40th Robbins Lecture at Pomona College in 2002.",,"robbins, nobel, non_us, bipoc",FALSE,2002,
K. Barry,Sharpless,TRUE,Dr.,"Born in 1941 in Philadelphia, Sharpless is best known for his work on chiral catalysts. Initially, he was a pre-medical student because his parents wished he, like his father, would become a doctor. He graduated from Dartmouth College in 1963 with a degree in Chemistry. In 1968, he graduated from Stanford University with a PhD and joined MIT for his postdoc work. In 1990, he became a W. M. Keck Professor of Chemistry at the Scripps Research Institute. K. Barry Sharpless won The Nobel Prize In Chemistry in 2001 for the development of the first Chiral catalyst. He was the Robbins Lecturer at Pomona College two years later.",,"robbins, nobel",TRUE,2003,
Kurt,Wüthrich,TRUE,Dr.,"Born in 1938, Kurt Wüthrich is notable for his work improving methods in protein nuclear magnetic resonance (NMR) spectroscopy. Growing up in a forest in rural Switzerland, Wüthrich developed an interest in natural science at a young age. He enrolled at the University of Bern (which he quickly outgrew) and then the University of Basel, where he majored in sports (he played competitive soccer from a young age well into his 50s) and earned a PhD in Chemistry. In 1969, Wüthrich became a professor at the Swiss Federal Institute of Technology, Zurich. Collaborating with fellow Robbins Lecturer Richard Ernst, Wüthrich developed new methods in NMR spectroscopy, including 2-dimensional NMR. He applied these new techniques to proteins, successfully discovering resonance structures for many biological molecules, like glucagon. For this work, Professor Wüthrich was awarded the 2002 Nobel Prize in Chemistry. He gave the 42th Robbins Lecture at Pomona College in 2004.",,"robbins, nobel",TRUE,2004,
Harry B.,Gray,TRUE,Dr.,"Born in 1935, Harry B. Gray is currently the Arnold O. Beckman professor of Chemistry at California Institute of Technology. Gray earned his Bachelor's in Chemistry from Western Kentucky University in 1957. Three years later, he received his PhD from Northwestern University in inorganic chemistry. He spent a year of doing postdoctoral work at the University of Copenhagen where he studied the electronic structure of metal complexes. Much of his research now is focused on Electronic Transfer chemistry. His most recent award was receiving Othmer Gold Medal in 2013. Harry B. Gray was the Robbins Lecturer at Pomona College in 2005.",,robbins,TRUE,2005,
George,Whitesides,TRUE,Dr.,"George Whitesides, born in 1939, is notable for his work in NMR spectroscopy, metal chemistry, and nanotechnology (among other research areas). He earned his PhD from Caltech in 1964, studying organometallic chemistry. He spent his first decade as a professor at MIT before moving to Harvard in 1982, becoming chair of the Chemistry Department. Unlike many scientists, Professor Whitesides’ research interests are varied and diverse, changing once a field becomes “saturated”. He is also passionate about science policy and education. He has served on committees of the National Science Foundation and advocated for stronger K-12 science and math education. Professor Whitesides is also a vocal advocate for further climate science research and action. He delivered the 44th Robbins Lecture at Pomona College in 2006.",,robbins,TRUE,2006,
Robert H.,Grubbs,TRUE,Dr.,"Robert Grubbs was born on a farm in Kentucky in 1942. Initially, he was interested in studying agriculture at the University of Florida but then found Organic Chemistry to be his passion.  He earned both his Bachelor’s (in 1963) and Master’s (in 1965) degrees from the University of Florida. He then continued his education at Columbia University to earn his PhD in 1968. Grubbs is most known for his work on metathesis, which is when hydrocarbons are converted into new hydrocarbons from the exchange of bonds. This led him to win The Nobel Prize in Chemistry in 2005. One of the implications of metathesis is the rise of green chemistry, which aims to minimize pollution. Robert H. Grubbs was the Robbins Lecturer at Pomona College in 2007. ",,"robbins, nobel",TRUE,2007,
Harold,Kroto,TRUE,Dr.,"Sir Harold Kroto, born in 1939, was best known for his discovery of the C60 allotrope, a stable structure of 60 carbon atoms. His parents were Jewish refugees from Eastern Europe, though he later renounced his faith and became an atheist and an opponent of religion. He studied chemistry at the University of Sheffield in England, obtaining his PhD in 1964 while also playing on the tennis team. After time spent overseas, Kroto became a Professor of Chemistry at the University of Sussex. At Sussex, Professor Kroto’s research focused on novel carbon compounds with unusual bonding structures. In 1985, Kroto discovered that C60, which he named buckminsterfullerene, could form spontaneously from condensing carbon-containing vapors at certain temperatures and pressures. For this work, Professor Kroto won the 1996 Nobel Prize in Chemistry. In 2004, Kroto moved to the warmer climate of Florida State University, where he continued his research until his retirement. Professor Kroto also actively contributed to science education, giving public lectures, writing opinion pieces, and producing documentaries. He delivered the 46th Robbins Lecture at Pomona College in 2008.",,"robbins, nobel, non_us",TRUE,2008,
Jennifer,Doudna,TRUE,Dr.,"Born in 1964, Jennifer Doudna is most famous for her work on CRISPR and gene editing. Even though she questioned her ability to pursue science, she graduated from Pomona College with a Bachelor’s of Art degree in biochemistry. In 1989, she earned her PhD in biochemistry from Harvard University. Both of Doudna’s parents encouraged her to read and pursue her inspiration. Jennifer Doudna’s work on CRISPR, which enabled researchers to make simpler and more efficient changes to DNA sequences, earned her the Nobel Prize in Chemistry in 2020. She was also named one of the Time top 100 most influential people in 2015 and the runner up for Time Person of the Year in 2016. Jennifer Doudna was the Robbins Lecturer at Pomona College in 2009. ",,"robbins, nobel, gender_minority, pomona_alum",FALSE,2009,
Jean-Marie,Lehn,TRUE,Dr.,"French chemist and Nobel Prize winner Jean-Marie Lehn is a pioneer in the field of supramolecular chemistry, the study of organic compounds that form without the normal binding of shared electrons. His work has enabled researchers to understand the principles of molecular recognition (how specific molecules are able to recognize and react with each other). Lehn was born in 1939 in Rosheim, a small medieval city of Alsace in France. The eldest of four sons, Lehn entered primary school after the end of World War II. Initially intent on studying philosophy as an undergraduate, he became fascinated by the experimental power of organic chemistry. After receiving his Ph.D in 1963, Lehn spent a year in Robert Burns Woodward’s laboratory at Harvard University, where he was involved with the synthesis of Vitamin B12.",,"robbins, nobel, non_us",TRUE,2009,photo saved as jeanmarie_lehn
Peter,Agre,TRUE,Dr.,"A native Minnesotan, Peter Agre studied chemistry at Augsburg College (B.A. 1970) and medicine at Johns Hopkins University (M.D. 1974). He completed his residency at Case Western Reserve University in Cleveland and an oncology fellowship at the University of North Carolina at Chapel Hill. Agre joined the Johns Hopkins School of Medicine faculty in 1984 and rose to the rank of professor of biological chemistry and professor of medicine. In January 2008, Agre became University Professor and director of the Malaria Research Institute at the Bloomberg School of Public Health. In 2003, Agre shared the Nobel Prize in Chemistry for discovering aquaporins, a family of water channel proteins that is found throughout nature and is responsible for numerous physiological processes in humans. Aquaporins are implicated in multiple clinical disorders, including malaria. Agre is a member of the National Academy of Sciences and the Institute of Medicine for which he chaired and serves on the Committee on Human Rights. In 2009, Agre served as president of the American Association for the Advancement of Science.",,"robbins, nobel",TRUE,2010,
J. Andrew,McCammon,TRUE,Dr.,"J. Andrew McCammon is the Joseph E. Mayer Chair Professor of Theoretical Chemistry and Distinguished Professor of Pharmacology at UC San Diego, and is an investigator of the Howard Hughes Medical Institute. He received his B.A. from Pomona College, and his Ph.D. in chemical physics from Harvard University, where he worked with John Deutch (of MIT). In 1976- 78, he developed the computer simulation approach to protein dynamics in Martin Karplus’s lab at Harvard. He joined the University of Houston as assistant professor of chemistry in 1978, and became the M.D. Anderson Chair Professor of Chemistry in 1981. He moved to UCSD in 1995. McCammon has invented theoretical methods for accurately predicting and interpreting molecular recognition, rates of reactions and other properties of chemical systems. These methods play a growing role in the design of new drugs and other materials. Professor McCammon is the author with Stephen Harvey of “Dynamics of Proteins and Nucleic Acids” (Cambridge University Press), and is the author or co-author of more than 650 publications in theoretical chemistry and biochemistry. More than 50 of his former students have tenured or tenure-track  positions at leading universities or research institutes.",,"robbins, pomona_alum",TRUE,2011,
Susan,Solomon,TRUE,Dr.,"Susan Solomon is the Ellen Swallow Richards Professor of Atmospheric Chemistry and Climate Science at the Massachusetts Institute of Technology. Solomon received her Ph.D. in chemistry from the University of California at Berkeley in 1981. She was a scientist at the National Oceanic and Atmospheric Administration in Boulder, Colo., from 1981 to 2011, and has been an adjunct professor at the University of Colorado from 1982 to present. She is best known for her pioneering research explaining why the ozone hole occurs in Antarctica, as well as obtaining some of the first chemical measurements that helped to establish the chlorofluorocarbons as its cause. She was the head project scientist of the National Ozone Expedition at McMurdo Station, Antarctica, in 1986-1987, and Solomon Glacier in Antarctica was subsequently named to recognize her accomplishments. Solomon has an abiding interest in historical meteorological data and is the author of a popular book on Antarctic history, “The Coldest March,” which was selected among the “2001 Books of the Year” by The New York Times, The Economist (U.K.) and the Independent (U.K.).",,"robbins, gender_minority",FALSE,2013,
Robert,Langer,TRUE,Dr.,"Robert S. Langer is the David H. Koch Institute Professor at MIT. (There are 11 Institute Professors at MIT; being an Institute  rofesso is the highest honor that can be awarded to a faculty member.) He has written more than 1,200 articles, and has more than 815 issued and pending patents worldwide. His patents have been licensed or sublicensed to more than 250 pharmaceutical, chemical, biotechnology and medical device companies. Langer is the most cited engineer in history. Professor Langer served as a member of the U.S. Food and Drug Administration’s SCIENCE Board, the FDA’s highest advisory board, from 1995 to 2002 and as its chairman from 1999 to 2002. ",,robbins,TRUE,2014,
Jack,Szostak,TRUE,Dr.,"Jack W. Szostak is an investigator of the Howard Hughes Medical Institute, professor of genetics at Harvard Medical School, professor of chemistry and chemical biology at Harvard University, and the Alex Rich Distinguished Investigator in the Department of Molecular Biology and the Center for Computational and Integrative Biology at Massachusetts General Hospital. His early research was on the genetics and biochemistry of DNA recombination and telomeres. Szostak’s current research interests are in the laboratory synthesis of self-replicating systems, the origin of life and applied evolutionary chemistry. He and his colleagues developed in vitro selection as a tool for the isolation of rare functional RNA, DNA and protein molecules from large pools of random sequences. In 2009, Szostak shared the Nobel Prize in Medicine or Physiology with Elizabeth Blackburn and Carol Greider for their work on telomeres and telomerase.",,"robbins, nobel",TRUE,2015,
W.E.,Moerner,TRUE,Dr.,"W. E. (William Esco) Moerner is the Harry S. Mosher Professor of Chemistry, chair of the Department of Chemistry and professor, by courtesy, of applied physics at Stanford University. He conducts research in physical chemistry and chemical physics of single molecules, single molecule biophysics, super-resolution imaging and tracking in cells, and trapping of single molecules in solution. His interests include methods of precise quantitation of single-molecule properties, strategies for three-dimensional imaging and tracking of single molecules, applications of single-molecule measurements to understand biological processes in cells, and observations of the photodynamics of single photosynthetic proteins and enzymes.",,robbins,TRUE,2016,
JoAnne,Stubbe,TRUE,Dr.,"Born in 1946, JoAnne Stubbe is most known for her work on ribonucleotide reductase. She received her Bachelor’s in chemistry from the University of Pennsylvania and her PhD in organic chemistry from the University of California, Berkeley. Having both of her parents as teachers, she initially wanted to pursue teaching but found herself to be more interested in research once she started working at the Yale University school of medicine. JoAnne Stubbe was able to discover how ribonucleotide reductase repair DNA molecules. She was the first woman to receive tenure in the MIT Chemistry Department. She received the National Medal of Science in 2009. JoAnne Stubbe was the Robbins Lecturer at Pomona College in 2017.",,"robbins, gender_minority",FALSE,2017,
Paul,Reider,TRUE,Dr.,"Paul Reider, born in 1951, is most well-known for his AIDS research and drug development expertise. He received his PhD from the University of Vermont before joining the pharmaceutical company Merck. Reider worked at Merck for 22 years, eventually becoming their Vice President of Process Chemistry. He conducted research on anti-AIDS drugs during the AIDS epidemic, successfully synthesizing Crixivan, a lifesaving antiretroviral for millions of AIDS patients. He later moved to Amgen, becoming their Worldwide Head of Chemistry Research and Discovery. In 2008, he joined Princeton University as a Professor of Chemistry. Outside of research, Professor Reider believes it is critical to make science more approachable to the public. He delivered the 56th Robbins Lecture at Pomona College in 2018.",,robbins,TRUE,2018,
Allison,Campbell,TRUE,Dr.,"Allison Campbell is the associate laboratory director for Earth and Biological Sciences at the Pacific Northwest National Laboratory (PNNL). As director, she sets the vision and strategy for PNNL's research in support of the Department of Energy Office (DOE) of Biological and Environmental Research and the National Institutes of Health.She previously served for more than ten years as the director of the Environmental Molecular Sciences Laboratory at PNNL, where she managed the rapid deployment of more than 30 new instruments funded by $60 million from the American Recovery and Reinvestment Act. She directed development of RadEMSL, a specialized facility designed to accelerate actinide chemistry studies, and oversaw construction of a Quiet Wing that houses a unique suite of high-resolution, advanced microscopes in EMSL/ As a researcher, Campbell is nationally recognized for individual contributions in materials development through her research in biomaterials. She is credited with co-inventing a bio-inspired process to ""grow"" a bioactive calcium phosphate layer, from the molecular level, onto the surfaces of artificial joint implants for hips and knees. The process extends the lives of the implants and makes them less likely to be rejected by the body. Campbell also is recognized for her work in understanding the role of proteins in biomineralization. Campbell was elected the 2017 president of the American Chemical Society, and in 2013, was named a fellow of the American Association for the Advancement of Science.",,"robbins, gender_minority",FALSE,2019,
Geraldine,Richmond,TRUE,Dr.,"Geraldine (Geri) Richmond received her B.S. degree in chemistry from Kansas State University and her Ph.D. in physical chemistry from the University of California, Berkeley. Her first academic appointment was at Bryn Mawr College in 1980. Since 1985 she has been on the faculty at the University of Oregon where she is the Presidential Chair in Science and professor of chemistry. Her research using laser spectroscopy and computational methods focuses on understanding environmentally and technologically important processes that occur at liquid surfaces. Richmond is a member of the U.S. National Academy of Sciences and a fellow of the American Academy of Arts and Sciences.",,"robbins, gender_minority",FALSE,2020,
